{
  "lumo_proof_version": "1.0.0",
  "source_integrity": {
    "source_file": "examples/grades.lumo",
    "source_sha256": "1e52db55068e4783877f40fc4017e03a11431c56d32c7d4f65044cc16757aac0",
    "source_line_count": 34,
    "ast_node_count": 88,
    "ast_structure_hash": "b4ab36de712735342acb20b07893c35b602ee1e1ccde3497ef5927eeb6a2c66e"
  },
  "declarations": {
    "variables": [
      { "name": "scores",  "declared_at_line": 3,  "type": "list",   "is_mutated": false, "mutation_lines": [] },
      { "name": "total",   "declared_at_line": 5,  "type": "number", "is_mutated": true,  "mutation_lines": [11] },
      { "name": "count",   "declared_at_line": 6,  "type": "number", "is_mutated": false, "mutation_lines": [] },
      { "name": "i",       "declared_at_line": 7,  "type": "number", "is_mutated": true,  "mutation_lines": [12] },
      { "name": "score",   "declared_at_line": 10, "type": "number", "is_mutated": false, "mutation_lines": [] },
      { "name": "average", "declared_at_line": 15, "type": "number", "is_mutated": false, "mutation_lines": [] },
      { "name": "j",       "declared_at_line": 18, "type": "number", "is_mutated": true,  "mutation_lines": [32] },
      { "name": "grade",   "declared_at_line": 20, "type": "number", "is_mutated": false, "mutation_lines": [] }
    ],
    "functions": []
  },
  "type_assertions": [
    { "line": 3,  "expression": "list 92, 85, 67, 74, 98, 53, 88", "asserted_type": "list",    "reasoning": "list literal of numbers" },
    { "line": 5,  "expression": "0",                                "asserted_type": "number",  "reasoning": "numeric literal" },
    { "line": 6,  "expression": "7",                                "asserted_type": "number",  "reasoning": "numeric literal" },
    { "line": 7,  "expression": "0",                                "asserted_type": "number",  "reasoning": "numeric literal" },
    { "line": 10, "expression": "get scores at i",                  "asserted_type": "number",  "reasoning": "scores is a list of numbers; element access yields number" },
    { "line": 11, "expression": "total plus score",                 "asserted_type": "number",  "reasoning": "number plus number is number" },
    { "line": 12, "expression": "i plus 1",                         "asserted_type": "number",  "reasoning": "number plus number is number" },
    { "line": 15, "expression": "total divby count",                "asserted_type": "number",  "reasoning": "number divby number is number" },
    { "line": 16, "expression": "\"Class average: \" plus average",  "asserted_type": "string",  "reasoning": "string plus number yields string concatenation" },
    { "line": 20, "expression": "get scores at j",                  "asserted_type": "number",  "reasoning": "scores is a list of numbers; element access yields number" },
    { "line": 32, "expression": "j plus 1",                         "asserted_type": "number",  "reasoning": "number plus number is number" }
  ],
  "safety_properties": {
    "no_uninitialized_access": {
      "verified": true,
      "evidence": [
        { "variable": "scores",  "first_use_line": 10, "declaration_line": 3,  "declaration_precedes_use": true },
        { "variable": "total",   "first_use_line": 11, "declaration_line": 5,  "declaration_precedes_use": true },
        { "variable": "count",   "first_use_line": 9,  "declaration_line": 6,  "declaration_precedes_use": true },
        { "variable": "i",       "first_use_line": 9,  "declaration_line": 7,  "declaration_precedes_use": true },
        { "variable": "score",   "first_use_line": 11, "declaration_line": 10, "declaration_precedes_use": true },
        { "variable": "average", "first_use_line": 16, "declaration_line": 15, "declaration_precedes_use": true },
        { "variable": "j",       "first_use_line": 19, "declaration_line": 18, "declaration_precedes_use": true },
        { "variable": "grade",   "first_use_line": 21, "declaration_line": 20, "declaration_precedes_use": true }
      ]
    },
    "no_division_by_zero": {
      "verified": true,
      "evidence": [
        {
          "line": 15,
          "divisor_expression": "count",
          "divisor_is_literal_nonzero": false,
          "guarded_by": "count is initialized to literal 7 and never mutated"
        }
      ]
    },
    "no_out_of_bounds_access": {
      "verified": true,
      "evidence": []
    },
    "no_infinite_loops": {
      "verified": true,
      "evidence": [
        {
          "loop_line": 9,
          "loop_type": "repeat_while",
          "termination_argument": "i starts at 0, increments by 1 each iteration (line 12), loop exits when i >= count (7), terminates after 7 iterations",
          "variant_expression": "count minus i",
          "terminates": true
        },
        {
          "loop_line": 19,
          "loop_type": "repeat_while",
          "termination_argument": "j starts at 0, increments by 1 each iteration (line 32), loop exits when j >= count (7), terminates after 7 iterations",
          "variant_expression": "count minus j",
          "terminates": true
        }
      ]
    },
    "no_unresolved_holes": { "verified": true, "hole_count": 0 },
    "no_unused_variables":  { "verified": true },
    "no_unreachable_code":  { "verified": true }
  },
  "contracts": {
    "functions": [],
    "loop_invariants": [
      {
        "loop_line": 9,
        "invariant": "i atleast 0 and i atmost 7 and total equals sum of scores[0..i-1]",
        "variant": "7 minus i",
        "terminates": true
      },
      {
        "loop_line": 19,
        "invariant": "j atleast 0 and j atmost 7",
        "variant": "7 minus j",
        "terminates": true
      }
    ]
  },
  "pattern_compliance": [
    { "pattern_id": "lumo:intent-required", "satisfied": true, "evidence": "intent declaration at line 1" }
  ],
  "vulnerability_analysis": {
    "input_sources": [],
    "injection_vectors": [],
    "resource_management": {
      "unbounded_allocations": false,
      "reasoning": "all lists are literal with fixed size 7; no dynamic growth"
    }
  }
}
